{"schema_version":"northstar.lifecycle.generation-closure.v1","generation":"g03","disposition":"closed","reason":"Compact default lifecycle and protocol reduction exhausted at g03.022. Tom approved the rollover on 2026-09-25 to open g04 for project knowledge currentness; watch items rehomed to g04 and decisions promoted to contract 001, bundle section 12 and the lifecycle reference.","tasks_digest":"sha256:8252334e80fc4d0c4d6588a6e10598ac6027836f0bbae073ddc79363607bb764","closed_at":"2026-09-25T00:00:00Z"}
